{
  "operation": "Principal",
  "timestamp": "2026-03-24T20:18:00Z",
  "authorized": true,
  "objective": "Enumerate privilege escalation vectors from svc-deploy to root. Focus on SSH CA cert signing, deployers group permissions, and deployment infrastructure.",
  "current_access": {
    "user": "svc-deploy",
    "privilege_level": "user (uid=1001, groups: svc-deploy, deployers)",
    "access_vector": "SSH with password D3pl0y_$$H_Now42!",
    "notes": "Stable SSH session, full TTY. Service account for deployment automation. Issues SSH certificates per platform activity logs."
  },
  "in_scope": [
    "Enumerate sudo permissions for svc-deploy",
    "Check cron jobs (user and system)",
    "Enumerate deployers group file permissions",
    "Investigate /opt/principal/ssh/ — SSH CA configuration, key material, cert signing capability",
    "Investigate /opt/principal/ — deployment scripts, configs, writable paths",
    "Check SUID/SGID binaries",
    "Enumerate running processes and their owners (especially Jetty)",
    "Check H2 database for credentials or writable access",
    "Check for writable system paths",
    "Enumerate other users' home directories for readable files"
  ],
  "out_of_scope": "Exploitation, modifying files, writing payloads, SSH cert forging, brute-forcing. Enumerate and report only.",
  "allowed_actions": [
    "Read files (cat, less, head)",
    "List directories and permissions (ls -la, find)",
    "Check sudo (sudo -l)",
    "List cron (crontab -l, ls /etc/cron*)",
    "Check processes (ps aux)",
    "Check SUID/SGID (find / -perm -4000, find / -perm -2000)",
    "Check group-writable files (find / -group deployers -writable)",
    "Read SSH CA config and key permissions",
    "Check capabilities (getcap)",
    "Read /etc/passwd, check home directories"
  ],
  "disallowed_actions": [
    "Modifying any file or configuration",
    "Writing SSH certificates or keys",
    "Running exploits or payloads",
    "Changing permissions",
    "Installing software",
    "Starting or stopping services",
    "Deleting anything"
  ],
  "completion_criteria": [
    "All enumeration vectors checked and documented",
    "Privesc leads ranked by confidence and feasibility",
    "Findings written to ../shared/noire_findings.md and noire_findings.json"
  ],
  "return_conditions": [
    "Enumeration complete",
    "Critical finding that requires immediate Oracle decision",
    "Access lost"
  ],
  "notes": "PRIORITY VECTORS:\n1. SSH CA at /opt/principal/ssh/ — svc-deploy issues SSH certs per platform logs. If svc-deploy can sign certs with the CA key, we can forge a cert for root. Check if CA private key is readable by svc-deploy or deployers group.\n2. deployers group (gid=1001) — check what files/dirs this group owns or can write to. Deployment scripts may run as root.\n3. Cron jobs — deployment automation likely has scheduled tasks.\n4. H2 database — embedded DB may be at /opt/principal/ with additional creds.\n\nKNOWN USERS: admin, svc-deploy, jthompson, amorales, bwright, kkumar, mwilson, lzhang\nPlatform version: v1.2.0, Java 21.0.10, Jetty 12.x"
}
