{
  "operation": "Snapped",
  "timestamp": "2026-03-25T18:25:00Z",
  "authorized": true,
  "objective": "Enumerate privilege escalation vectors from jonathan (uid=1000) on Snapped (10.129.9.2). Report findings — do not attempt exploitation.",
  "current_access": {
    "user": "jonathan",
    "privilege_level": "user (uid=1000, gid=1000)",
    "access_vector": "SSH with password (linkinpark)",
    "notes": "Stable SSH shell. Only member of group jonathan. Nginx UI v2.3.2 runs on the box — check what user it runs as and whether it has elevated privileges."
  },
  "in_scope": [
    "Local enumeration of Snapped (10.129.9.2) as jonathan",
    "SUID/SGID binaries, capabilities, sudo permissions",
    "Cron jobs, timers, scheduled tasks",
    "Writable files/directories owned by root or other users",
    "Running processes and services (especially nginx-ui)",
    "Installed software versions for known local exploits",
    "Kernel version and OS release",
    "Network services listening on localhost only",
    "Home directories, config files, SSH keys",
    "Nginx UI configuration and database at /var/lib/nginx-ui/ or similar",
    "Group memberships and interesting file ACLs"
  ],
  "out_of_scope": "Other hosts on the network. Do not pivot or scan beyond 10.129.9.2.",
  "allowed_actions": [
    "Read files accessible to jonathan",
    "List processes, services, cron jobs, timers",
    "Check sudo -l",
    "Enumerate SUID/SGID/capabilities",
    "Check writable paths and interesting permissions",
    "Read nginx-ui config/database if accessible",
    "Check kernel version and installed packages",
    "Enumerate local network listeners"
  ],
  "disallowed_actions": [
    "Do not attempt exploitation or privilege escalation",
    "Do not modify any files on the target",
    "Do not upload tools or scripts",
    "Do not create new users or modify accounts",
    "Do not stop/restart services"
  ],
  "completion_criteria": [
    "sudo permissions checked",
    "SUID/SGID/capabilities enumerated",
    "Cron and timers reviewed",
    "Running services and their users identified",
    "Nginx UI process user and config location confirmed",
    "Kernel and OS version recorded",
    "All privesc leads documented in noire_findings.md and memoria"
  ],
  "return_conditions": [
    "All enumeration complete — return with findings",
    "Access lost — report last known state",
    "Critical finding discovered — return immediately with details"
  ],
  "notes": "SSH creds: jonathan / linkinpark. Nginx UI v2.3.2 is running on port 9000 (proxied via nginx on 80). It could NOT write to /etc/nginx/ when we tried via the API — check what user it runs as and whether it has any special privileges. The admin bcrypt hash was NOT cracked — only jonathan's was. Check if there are other users on the system."
}
